{
  "$schema": "http://json-schema.org/draft-07/schema#",
  "title": "Flagrix Detection Rules Schema",
  "description": "Schema for validating Flagrix YAML rule files after compilation to JSON",
  "type": "object",
  "required": [
    "version",
    "lastUpdated",
    "maliciousPackages",
    "yaraRules",
    "knownBadHashes",
    "userProfileRules"
  ],
  "properties": {
    "version": {
      "type": "string",
      "description": "Signature database version (e.g. 2025.01.26.001)",
      "pattern": "^\\d{4}\\.\\d{2}\\.\\d{2}\\.\\d{3}$"
    },
    "lastUpdated": {
      "type": "string",
      "description": "ISO 8601 timestamp"
    },
    "maliciousPackages": {
      "type": "array",
      "items": {
        "type": "object",
        "required": [
          "name",
          "severity",
          "source"
        ],
        "properties": {
          "name": {
            "type": "string"
          },
          "severity": {
            "type": "string",
            "enum": [
              "critical",
              "high",
              "medium",
              "low"
            ]
          },
          "source": {
            "type": "string"
          },
          "version": {
            "type": "string"
          },
          "description": {
            "type": "string"
          }
        },
        "additionalProperties": false
      }
    },
    "yaraRules": {
      "type": "array",
      "items": {
        "type": "object",
        "required": [
          "id",
          "name",
          "pattern",
          "description",
          "tags",
          "severity"
        ],
        "properties": {
          "id": {
            "type": "string",
            "pattern": "^[A-Z][A-Z0-9_]+$"
          },
          "name": {
            "type": "string"
          },
          "pattern": {
            "type": "string"
          },
          "description": {
            "type": "string"
          },
          "tags": {
            "type": "array",
            "items": {
              "type": "string"
            }
          },
          "severity": {
            "type": "string",
            "enum": [
              "critical",
              "high",
              "medium",
              "low"
            ]
          },
          "minMatches": {
            "type": "integer",
            "minimum": 2,
            "description": "Minimum regex matches in one file before the rule fires (default 1)"
          },
          "fileExtensions": {
            "type": "array",
            "items": {
              "type": "string",
              "pattern": "^\\."
            },
            "minItems": 1,
            "description": "Restrict the rule to these file extensions"
          }
        },
        "additionalProperties": false
      }
    },
    "knownBadHashes": {
      "type": "array",
      "items": {
        "type": "object",
        "required": [
          "sha256",
          "type",
          "source"
        ],
        "properties": {
          "sha256": {
            "type": "string",
            "pattern": "^[a-f0-9]{64}$"
          },
          "type": {
            "type": "string",
            "enum": [
              "pdf",
              "js",
              "binary",
              "archive"
            ]
          },
          "malwareFamily": {
            "type": "string"
          },
          "source": {
            "type": "string"
          },
          "description": {
            "type": "string"
          }
        },
        "additionalProperties": false
      }
    },
    "userProfileRules": {
      "type": "object",
      "description": "GitHub user-profile scoring ruleset consumed by the scanner",
      "required": [
        "riskFactors",
        "trustSignals",
        "riskLevels"
      ],
      "properties": {
        "riskFactors": {
          "type": "array",
          "items": {
            "$ref": "#/$defs/profileRule"
          }
        },
        "trustSignals": {
          "type": "array",
          "items": {
            "$ref": "#/$defs/profileRule"
          }
        },
        "riskLevels": {
          "type": "object",
          "required": [
            "mediumMinScore",
            "highMinScore",
            "recommendations"
          ],
          "properties": {
            "mediumMinScore": {
              "type": "number"
            },
            "highMinScore": {
              "type": "number"
            },
            "recommendations": {
              "type": "object",
              "required": [
                "low",
                "medium",
                "high"
              ],
              "properties": {
                "low": {
                  "type": "string"
                },
                "medium": {
                  "type": "string"
                },
                "high": {
                  "type": "string"
                }
              },
              "additionalProperties": false
            }
          },
          "additionalProperties": false
        }
      },
      "additionalProperties": false
    }
  },
  "additionalProperties": false,
  "$defs": {
    "profileCondition": {
      "type": "object",
      "properties": {
        "field": {
          "type": "string"
        },
        "operator": {
          "type": "string",
          "enum": [
            "lt",
            "lte",
            "gt",
            "gte",
            "eq"
          ]
        },
        "value": {
          "type": [
            "number",
            "boolean"
          ]
        }
      },
      "additionalProperties": false
    },
    "profileRule": {
      "type": "object",
      "required": [
        "id",
        "name",
        "description",
        "weight",
        "condition"
      ],
      "properties": {
        "id": {
          "type": "string",
          "pattern": "^[A-Z][A-Z0-9_]+$"
        },
        "name": {
          "type": "string"
        },
        "description": {
          "type": "string"
        },
        "weight": {
          "type": "number"
        },
        "exclusiveWith": {
          "type": "string"
        },
        "condition": {
          "type": "object",
          "oneOf": [
            {
              "required": [
                "field",
                "operator",
                "value"
              ],
              "properties": {
                "field": {
                  "type": "string"
                },
                "operator": {
                  "type": "string",
                  "enum": [
                    "lt",
                    "lte",
                    "gt",
                    "gte",
                    "eq"
                  ]
                },
                "value": {
                  "type": [
                    "number",
                    "boolean"
                  ]
                }
              },
              "additionalProperties": false
            },
            {
              "required": [
                "all"
              ],
              "properties": {
                "all": {
                  "type": "array",
                  "items": {
                    "$ref": "#/$defs/profileCondition"
                  }
                }
              },
              "additionalProperties": false
            }
          ]
        }
      },
      "additionalProperties": false
    }
  }
}