{
  "version": "2026.07.09.002",
  "lastUpdated": "2026-07-09T19:15:53.681Z",
  "maliciousPackages": [
    {
      "name": "beavertail",
      "severity": "critical",
      "source": "lazarus",
      "description": "North Korean Lazarus Group malware loader — targets developers via fake job interviews"
    },
    {
      "name": "invisible-ferret",
      "severity": "critical",
      "source": "lazarus",
      "description": "Python-based data exfiltration malware from Lazarus Group — steals browser data, files, SSH keys"
    },
    {
      "name": "call-bind-apply-helpers",
      "severity": "critical",
      "source": "lazarus",
      "description": "Typosquat with BeaverTail malware payload — mimics legitimate npm utility"
    },
    {
      "name": "cors-parser",
      "severity": "critical",
      "source": "lazarus",
      "description": "Fake CORS parsing package with backdoor — distributed via fake LinkedIn job offers"
    },
    {
      "name": "helmet-async",
      "severity": "critical",
      "source": "lazarus",
      "description": "Typosquat of the legitimate 'helmet' security middleware — contains BeaverTail loader"
    },
    {
      "name": "crossenv",
      "severity": "high",
      "source": "npm-audit",
      "description": "Typosquat of 'cross-env' — published in 2017 npm typosquat attack, steals env vars"
    },
    {
      "name": "lodahs",
      "severity": "high",
      "source": "npm-audit",
      "description": "Typosquat of 'lodash'"
    },
    {
      "name": "lodashs",
      "severity": "high",
      "source": "npm-audit",
      "description": "Typosquat of 'lodash'"
    },
    {
      "name": "electorn",
      "severity": "high",
      "source": "npm-audit",
      "description": "Typosquat of 'electron' — commonly installed by developers"
    },
    {
      "name": "event-stream",
      "severity": "high",
      "source": "npm-audit",
      "version": "3.3.6",
      "description": "Compromised version of the popular event-stream package (v3.3.6) — contained cryptocurrency wallet stealing payload targeting Copay Bitcoin wallet\n"
    },
    {
      "name": "flatmap-stream",
      "severity": "critical",
      "source": "npm-audit",
      "description": "Malicious dependency injected via compromised event-stream — contained the actual payload"
    },
    {
      "name": "bcrypts-js",
      "severity": "high",
      "source": "npm-audit",
      "description": "Typosquat of 'bcrypt-js'"
    },
    {
      "name": "mongose",
      "severity": "high",
      "source": "npm-audit",
      "description": "Typosquat of 'mongoose'"
    },
    {
      "name": "expres",
      "severity": "high",
      "source": "npm-audit",
      "description": "Typosquat of 'express'"
    },
    {
      "name": "colourama",
      "severity": "high",
      "source": "pypi-audit",
      "description": "Typosquat of 'colorama' — steals clipboard content and cryptocurrency addresses"
    },
    {
      "name": "python-dateutils",
      "severity": "high",
      "source": "pypi-audit",
      "description": "Typosquat of 'python-dateutil'"
    },
    {
      "name": "requesrs",
      "severity": "high",
      "source": "pypi-audit",
      "description": "Typosquat of 'requests'"
    },
    {
      "name": "setup-tools",
      "severity": "high",
      "source": "pypi-audit",
      "description": "Typosquat of 'setuptools' — commonly targets CI/CD environments"
    },
    {
      "name": "loguru-logger",
      "severity": "high",
      "source": "pypi-audit",
      "description": "Typosquat of 'loguru' — popular Python logging library"
    }
  ],
  "yaraRules": [
    {
      "id": "BEAVERTAIL_LOADER_V1",
      "name": "BeaverTail Loader Pattern",
      "pattern": "require\\(['\"]child_process['\"]\\)\\.exec.*\\bhttp[s]?://",
      "description": "Matches BeaverTail malware loader pattern used by Lazarus Group in fake job interview repos",
      "tags": [
        "lazarus",
        "beavertail",
        "loader",
        "apt"
      ],
      "severity": "critical",
      "fileExtensions": [
        ".js",
        ".jsx",
        ".mjs",
        ".cjs",
        ".ts",
        ".tsx"
      ]
    },
    {
      "id": "BEAVERTAIL_EXFIL",
      "name": "BeaverTail Data Exfiltration",
      "pattern": "process\\.env.*JSON\\.stringify.*fetch|axios\\.post",
      "description": "Environment variable exfiltration pattern — process.env dumped via fetch/axios POST",
      "tags": [
        "lazarus",
        "beavertail",
        "exfiltration",
        "apt"
      ],
      "severity": "critical",
      "fileExtensions": [
        ".js",
        ".jsx",
        ".mjs",
        ".cjs",
        ".ts",
        ".tsx"
      ]
    },
    {
      "id": "INVISIBLEFERRET_KEYLOG",
      "name": "InvisibleFerret Keylogger",
      "pattern": "keyboard\\.on_press|pynput\\.keyboard|from\\s+pynput",
      "description": "Keylogger pattern using pynput — used by Lazarus Group's InvisibleFerret Python malware",
      "tags": [
        "lazarus",
        "invisibleferret",
        "keylogger",
        "apt"
      ],
      "severity": "critical",
      "fileExtensions": [
        ".py"
      ]
    },
    {
      "id": "REVERSE_SHELL",
      "name": "Reverse Shell Pattern",
      "pattern": "\\bnet\\.Socket\\(\\)|socket\\.socket.*SOCK_STREAM.*connect",
      "description": "Socket-based reverse shell connection — creates a TCP connection back to attacker",
      "tags": [
        "shell",
        "backdoor",
        "remote-access"
      ],
      "severity": "critical",
      "fileExtensions": [
        ".js",
        ".jsx",
        ".mjs",
        ".cjs",
        ".ts",
        ".tsx",
        ".py"
      ]
    },
    {
      "id": "CRYPTO_MINER",
      "name": "Cryptocurrency Miner",
      "pattern": "stratum\\+tcp://|xmrig|cryptonight",
      "description": "Cryptocurrency mining code — uses CPU resources for attacker profit",
      "tags": [
        "miner",
        "crypto",
        "resource-abuse"
      ],
      "severity": "critical",
      "fileExtensions": [
        ".js",
        ".jsx",
        ".mjs",
        ".cjs",
        ".ts",
        ".tsx",
        ".py",
        ".rb",
        ".php",
        ".go",
        ".sh",
        ".ps1",
        ".psm1"
      ]
    },
    {
      "id": "CREDENTIAL_THEFT",
      "name": "Browser Credential Theft",
      "pattern": "chrome.*Login Data|firefox.*logins\\.json|find-generic-password|find-internet-password|dump-keychain",
      "description": "Reads browser password databases (Chrome Login Data, Firefox logins.json) or dumps the macOS Keychain via the security(1) command",
      "tags": [
        "credentials",
        "theft",
        "stealer"
      ],
      "severity": "critical",
      "fileExtensions": [
        ".js",
        ".jsx",
        ".mjs",
        ".cjs",
        ".ts",
        ".tsx",
        ".py",
        ".rb",
        ".php",
        ".go",
        ".sh"
      ]
    },
    {
      "id": "ENV_EXFIL_WEBHOOK",
      "name": "Environment Variables to Webhook Exfiltration",
      "pattern": "process\\.env.*discord\\.com/api/webhooks|os\\.environ.*webhook.*post|process\\.env.*ntfy\\.sh",
      "description": "Sends environment variables (secrets, API keys) to Discord/ntfy webhook",
      "tags": [
        "exfiltration",
        "webhook",
        "secrets"
      ],
      "severity": "high",
      "fileExtensions": [
        ".js",
        ".jsx",
        ".mjs",
        ".cjs",
        ".ts",
        ".tsx",
        ".py"
      ]
    },
    {
      "id": "DISCORD_WEBHOOK_EXFIL",
      "name": "Discord Webhook Data Exfiltration",
      "pattern": "discord\\.com/api/webhooks.*process\\.env|discord\\.com/api/webhooks.*os\\.environ",
      "description": "Sends sensitive data (env vars, credentials) to Discord webhook endpoint",
      "tags": [
        "exfiltration",
        "discord",
        "webhook"
      ],
      "severity": "high",
      "fileExtensions": [
        ".js",
        ".jsx",
        ".mjs",
        ".cjs",
        ".ts",
        ".tsx",
        ".py"
      ]
    },
    {
      "id": "OBFUSCATED_EVAL",
      "name": "Obfuscated Eval Execution",
      "pattern": "eval\\(atob\\(|eval\\(Buffer\\.from\\(.*base64",
      "description": "Base64-encoded eval execution — decodes and executes hidden payload",
      "tags": [
        "obfuscation",
        "eval",
        "payload"
      ],
      "severity": "high",
      "fileExtensions": [
        ".js",
        ".jsx",
        ".mjs",
        ".cjs",
        ".ts",
        ".tsx"
      ]
    },
    {
      "id": "HARDCODED_AWS_KEY",
      "name": "Hardcoded AWS Access Key",
      "pattern": "AKIA[0-9A-Z]{16}",
      "description": "AWS Access Key ID pattern (AKIA...) committed to source code",
      "tags": [
        "secrets",
        "aws",
        "credentials"
      ],
      "severity": "critical",
      "fileExtensions": [
        ".js",
        ".jsx",
        ".mjs",
        ".cjs",
        ".ts",
        ".tsx",
        ".py",
        ".rb",
        ".php",
        ".go",
        ".sh",
        ".env",
        ".json",
        ".yaml",
        ".yml"
      ]
    },
    {
      "id": "HARDCODED_GITHUB_TOKEN",
      "name": "Hardcoded GitHub Token",
      "pattern": "ghp_[a-zA-Z0-9]{36}|gho_[a-zA-Z0-9]{36}",
      "description": "GitHub Personal Access Token (ghp_) or OAuth token (gho_) in source code",
      "tags": [
        "secrets",
        "github",
        "credentials"
      ],
      "severity": "critical",
      "fileExtensions": [
        ".js",
        ".jsx",
        ".mjs",
        ".cjs",
        ".ts",
        ".tsx",
        ".py",
        ".rb",
        ".php",
        ".go",
        ".sh",
        ".yaml",
        ".yml"
      ]
    },
    {
      "id": "HARDCODED_STRIPE_KEY",
      "name": "Hardcoded Stripe Live Key",
      "pattern": "sk_live_[a-zA-Z0-9]{24,}",
      "description": "Stripe live secret key pattern in source code",
      "tags": [
        "secrets",
        "stripe",